{
  "$schema": "https://json-schema.org/draft/2020-12/schema",
  "$id": "https://astro-knowledge.local/schema/modifier.schema.json",
  "type": "object",
  "additionalProperties": false,
  "required": ["id", "appliesTo", "summary", "body", "voiceNeutral", "status"],
  "properties": {
    "id": { "type": "string" },
    "appliesTo": { "type": "array", "items": { "type": "string" } },
    "summary": { "type": "string" },
    "body": { "type": "string" },
    "role": { "type": "string" },
    "category": { "type": "string" },
    "schema": { "type": "string" },
    "definition": { "type": "string" },
    "appUsage": {
      "oneOf": [
        { "type": "string" },
        { "type": "array", "items": { "type": "string" } }
      ]
    },
    "note": { "type": "string" },
    "classes": { "type": "object" },
    "phases": { "type": "object" },
    "voidOfCourse": { "type": "object" },
    "bonification": { "type": "object" },
    "maltreatment": { "type": "object" },
    "overcoming": { "type": "string" },
    "retrograde": { "type": "object" },
    "station": { "type": "object" },
    "notApplicable": { "type": "array", "items": { "type": "string" } },
    "cazimi": { "type": "object" },
    "combust": { "type": "object" },
    "underTheBeams": { "type": "object" },
    "freeOfBeams": { "type": "object" },
    "orientality": { "type": "object" },
    "domicile": { "type": "object" },
    "exaltation": { "type": "object" },
    "detriment": { "type": "object" },
    "fall": { "type": "object" },
    "triplicityLordsDorothean": { "type": "object" },
    "boundsEgyptian": { "type": "object" },
    "boundsNote": { "type": "string" },
    "decansChaldean": { "type": "object" },
    "decansNote": { "type": "string" },
    "annualProfections": { "type": "object" },
    "zodiacalReleasing": { "type": "object" },
    "planets": { "type": "object" },
    "rulershipPolicy": { "type": "object" },
    "surfacePolicy": { "type": "object" },
    "houseSystemPolicy": { "type": "object" },
    "prohibitions": { "type": "array", "items": { "type": "string" } },
    "weighting": { "type": "array", "items": { "type": "string" } },
    "orbs": { "type": "object" },
    "determination": { "type": "object" },
    "howToRead": { "type": "array", "items": { "type": "string" } },
    "rulers": { "type": "object" },
    "chartSect": { "type": "object" },
    "planetSect": { "type": "object" },
    "mercuryRule": { "type": "string" },
    "benefics": { "type": "object" },
    "malefics": { "type": "object" },
    "sectBenefic": { "type": "object" },
    "sectMalefic": { "type": "object" },
    "inSect": { "type": "string" },
    "outOfSect": { "type": "string" },
    "paradox": { "type": "string" },
    "testimony": { "type": "string" },
    "voiceNeutral": { "const": true },
    "status": { "enum": ["TODO", "DRAFT", "REVIEWED", "LIVE"] }
  }
}
